scope,theme,phrase,doc_count,early_share,late_share,trend_delta,sample_titles
community_announcements,Community / Creator / Social / UGC,off discount don't,1969,0.0255,0.0000,-0.0255,Tower of Ardia: Psychic Guardian Super Splendor Is Now Available! | Tower of Ardia: Explorers of the Abyss Is Now Available! | Tower of Ardia: Evening Starter Is Now Available!
community_announcements,Community / Creator / Social / UGC,10% off discount,2004,0.0242,0.0000,-0.0242,Loopmancer: LOOPMANCER is now available！ | Tower of Ardia: Explorers of the Abyss Is Now Available! | Tower of Ardia: Evening Starter Is Now Available!
community_announcements,Community / Creator / Social / UGC,date,2515,0.0295,0.0116,-0.0179,"Erotic Cosmic Sheriff ORGIVAN – Vol. 1: – Patch Notes and Roadmap of upcoming updates | RoRX: Devlog #4 on Sunday, August 11th at 8:00 PM CET + Contest, remember the date! | PROTON VR: Devblog #1: Identity Crisis"
community_announcements,Community / Creator / Social / UGC,stay date,1340,0.0162,0.0004,-0.0158,Erotic Cosmic Sheriff ORGIVAN – Vol. 1: – Patch Notes and Roadmap of upcoming updates | Fall Into Insanity: Join the Scotty Games Discord Server! | Arcfall: Christmas In Arcfall
community_announcements,Partnerships / Crossovers / IP Collaborations,demo,1336,0.0261,0.0673,0.0413,ATMOSFAR: Play ATMOSFAR at Steam Next Fest! | Space Salvage Simulator: 0.61_demo Patch Notes | ToeJam & Earl: Back in the Groove!: Dancing with Ghosts Demo and Kickstarter LIVE
community_announcements,Partnerships / Crossovers / IP Collaborations,sale,2674,0.0659,0.1071,0.0412,Crypto Miner Tycoon Simulator Starter Edition: 🎁❄️Steam Winter Sale❄️🎁 | Human Guise: Chapter Ⅰ: Final sale | BREAK ARTS II: BREAK ARTS III Out Now! Mech Customization Contest Now Underway!
community_announcements,Partnerships / Crossovers / IP Collaborations,collaboration,1932,0.0490,0.0806,0.0315,Murders on the Yangtze River: The Murders on the Yangtze River × The Sultan’s Game–Choices and Reasoning | Long Gone Days: The Long Gone Days physical editions are officially open for pre-order! | Wizard of Legend: Wizard of Legend 2 - Full Release Out Today
community_announcements,Partnerships / Crossovers / IP Collaborations,spring sale,250,0.0033,0.0287,0.0254,BioShock™ 2 Remastered: Fresh Deals in Full Bloom: Save Big During the 2K Spring Sale | The Shimmering Horizon and Cursed Blacksmith: Steam Spring Sale & Community Items! | Squad: Spring into Squad with the Steam Spring Sale!
community_announcements,Partnerships / Crossovers / IP Collaborations,discount,1016,0.0228,0.0464,0.0236,Human Guise: Chapter Ⅰ: Final sale | Mini Painter: Cozy bundle & a piping hot discount. | Holy Potatoes! We’re in Space?!: Holy Potatoes! A Steam Summer Sale?!
community_announcements,Partnerships / Crossovers / IP Collaborations,during spring sale,103,0.0014,0.0166,0.0151,BioShock™ 2 Remastered: Fresh Deals in Full Bloom: Save Big During the 2K Spring Sale | SWAPMEAT: Swapmeat is 40% off during the Steam Spring Sale! | 3°C: Sand Puzzle: Save up to 60% on 52 KEMCO titles during the Spring Sale!
community_announcements,Partnerships / Crossovers / IP Collaborations,dlc,1143,0.0340,0.0486,0.0146,Japanese School Life: Ditzy Demons Released + Announcements! | UBOAT: UBOAT x Ship Graveyard Simulator 2 Crossover | Supreme Ruler 1936: Supreme Ruler 1936 Remastered DLC Released for SR2030
community_announcements,Partnerships / Crossovers / IP Collaborations,winter sale,256,0.0058,0.0199,0.0141,Crypto Miner Tycoon Simulator Starter Edition: 🎁❄️Steam Winter Sale❄️🎁 | Fish Stick Protocol: Holiday Season Update! | Revenge of the Spirit: Rite of Resurrection: Steam Winter Sale 2018
community_announcements,Partnerships / Crossovers / IP Collaborations,update,7779,0.2289,0.1876,-0.0413,"A Magical High School Girl / 魔法の女子高生: Issues with Ver. 1.901C | Kentum: Spoiling You with a New Update (But Not Your Food) | 4STORY : The Original: 4Story: The Original Unveils Androberry on November 26, 2025"
community_announcements,Partnerships / Crossovers / IP Collaborations,bug,1762,0.0516,0.0298,-0.0218,Kentum: Spoiling You with a New Update (But Not Your Food) | Automata Empire: Update 4.1: Fixed Leaderboard and Crash Bug | XENOTILT: HOSTILE PINBALL ACTION: 1.91
community_announcements,Partnerships / Crossovers / IP Collaborations,patch,2899,0.0878,0.0662,-0.0216,Space Salvage Simulator: 0.61_demo Patch Notes | Unbox: Newbie's Adventure: Patch Notes 21/08/17 | Lucius III: PATCH NOTES: 1.190128164141.a
community_announcements,Partnerships / Crossovers / IP Collaborations,fixes,1954,0.0573,0.0464,-0.0110,Kentum: Spoiling You with a New Update (But Not Your Food) | Hotdog: The Videogame: Keybindings update | Sickness: Version 1.4.5
community_announcements,Partnerships / Crossovers / IP Collaborations,wallpaper release,250,0.0108,0.0000,-0.0108,Saint Emiliana: Exclusive Treasure Hunter Claire Wallpaper | Saint Emiliana: Exclusive President Yukino Wallpaper | Lessons with Chii-chan: Exclusive Fallen ~Makina and the City of Ruins~ Wallpaper
community_announcements,Partnerships / Crossovers / IP Collaborations,crossover,422,0.0137,0.0033,-0.0104,UBOAT: UBOAT x Ship Graveyard Simulator 2 Crossover | Cyber Paradise: Dog Digital Revival Adventure & Epic Crossover | My Slime Garden: My Slime Garden X Witchfall Event Coming Soon!
community_announcements,Partnerships / Crossovers / IP Collaborations,fixed bug,490,0.0147,0.0044,-0.0103,XENOTILT: HOSTILE PINBALL ACTION: 1.91 | RhythmStrike: Update 0.1.1 - Patch Notes | Diggin It: Small bug fix
community_announcements,Partnerships / Crossovers / IP Collaborations,hotfix,717,0.0207,0.0110,-0.0097,Umigame: 0.3.3 Hotfix | ENDLESS™ Legend 2: Update #20 - Maybe last Hotfix (?) before PTB 🤷 | Churn Vector: Hotfix 61e24a03
community_announcements,Other,demo,17815,0.0326,0.1037,0.0711,Seven Seas Solitaire: Play the Avalon Jewels 2 Demo | Crypto Miner Tycoon Simulator Starter Edition: Steam Next Fest Demo Offer | Choppa (Classic): Choppa: Rescue Rivals Demo at Gamescom 2021!
community_announcements,Other,demo available,2571,0.0051,0.0152,0.0102,GRIDD: Retroenhanced: Demo now available! | Super Gear Quest: Kewtia Crystallite Hunt Demo now available! | ZaciSa: Idle Defense!: Demo Now Available!
community_announcements,Other,demo live,1232,0.0022,0.0098,0.0076,Arcade Paradise VR: The Hotel Architect Demo is now live! | Space Food Truck: Try Mage Food Truck Today! | Beyond Gravity: Ball King Jam demo is live with local multiplayer for up to 4 players!
community_announcements,Other,date,2369,0.0060,0.0112,0.0053,WRATH: Aeon of Ruin VR - Brutal Edition: WRATH: Aeon of Ruin VR - Brutal Edition Drop Date | Hop Step Sing! Kisekiteki Shining! (HQ Edition): The first solo VRMV by Shikiri Shiishiba | Bot Vice: Evil Tonight is now available for purchase on Steam!
community_announcements,Other,free demo,1505,0.0032,0.0080,0.0048,Doodle God: 8-bit Mania - Collector's Item: Flow Legends - A New Puzzle Adventure Is Coming to Steam! 🧩✨ | BlastBall: All-Stars: BlastBall: All-Stars at Steam Next Fest | Death's Hangover: Our new surgery title! With free demo!
community_announcements,Other,start date,181,0.0001,0.0044,0.0042,"A Sex Slave's  Love Story: 【Playmeow】Countdown to your official start date: 7 days 💌!《Let's Start Managing the Sexual Relief Department!》On 3/10, the self-made harem project kicks off in full 🫦 | Let's Start Managing the Sexual Relief Department!: 【Playmeow】Appointment letter for you to sign 🖋️《Let's Start Managing the Sexual Relief Department!》March 10th Your start date is coming up—please be on time 📣 | Airsoft Online: Sign up for Playtests is now open!"
community_announcements,Other,bug,5820,0.0121,0.0163,0.0042,Black Rose: Pink Screen Bug | My Card Is Better Than Your Card!: Patch 20260129.1 Notes | 流木缘Driftwood Fate: 4月10日更新
community_announcements,Other,fest demo,763,0.0012,0.0051,0.0039,Crypto Miner Tycoon Simulator Starter Edition: Steam Next Fest Demo Offer | Down with the Ship: Steam Next Fest Demo | Moving Out 2: Team17 Stream the Moving Out 2 Steam Next Fest Demo
community_announcements,Other,soon,10807,0.0316,0.0166,-0.0151,"Bing in Wonderland: Bing in Wonderland is set to win Steam's 2023 Visual Style Award soon! | 123 Slaughter Me Street 2: Impulse Game Studios, LLC. Steam Curator Page | FIND ALL: Christmas 2025 🎁🎄🔔: FIND ALL: Valentine's Day - 🍫ADD WISHLIST!💘"
community_announcements,Other,available soon,4080,0.0136,0.0016,-0.0120,SPLIT BULLET: Announcing new game from the dev! | Punishing: Gray Raven: Punishing: Gray Raven Global Steam Release FAQ | Phantom Containment: Demo
community_announcements,Other,puzzle available soon,1636,0.0045,0.0006,-0.0039,"Space Memory: Dinosaurs: 🖌️🍄🌈Our new colorful puzzle game ""Color Splash: Mushrooms"" in Steam Store!🌈🍄🖌️ | Space Memory: Dinosaurs: 🖌️🦜🌈Our new colorful puzzle game ""Color Splash: Parrots"" in Steam Store!🌈🦜🖌️ | Space Memory: Dinosaurs: ✨🦉✨Our new stylish puzzle game ""Neon Fantasy: Owls"" in Steam Store!✨🦉✨"
community_announcements,Other,store available soon,989,0.0035,0.0000,-0.0035,"Choco Pixel S: 🍫🍬🍫New part of our casual puzzle game ""Choco Pixel D"" in Steam Store!🍫🍬🍫 | Choco Pixel S: 🍫🍬🍫New part of our casual puzzle game ""Choco Pixel X"" in Steam Store!🍫🍬🍫 | Data mining X: 🟪💾📄 Data mining X in Steam Store ! 📄💾🟪"
community_announcements,Other,patch,11235,0.0314,0.0283,-0.0032,Bocce Time! VR: New Park Available! Head on down to Serafin Pier! | Bocce Time! VR: Player Avatars Have Arrived | Bocce Time! VR: Bocce Time now supports up to 8 players!
community_announcements,Other,content,4902,0.0137,0.0112,-0.0025,SAMURAI WARRIORS: Spirit of Sanada: “SAMURAI WARRIORS 4 DX” is now available on Steam !! | Crossing Man: Termination Notice | Daily Chthonicle: Editor's Edition: Corona Celestia Kickstarter Campaign
community_announcements,Other,feature,3125,0.0090,0.0069,-0.0021,Bocce Time! VR: New Match Settings unlock all new options and support for up to 4 teams! | Twisted Gallery 异馆: Patch Note v1.3 | Log.in: 2026_01_17_02:30_Partial Text Revisions for the Hint Feature
community_announcements,Other,bugs,3196,0.0085,0.0066,-0.0019,My Card Is Better Than Your Card!: Patch 20260129.1 Notes | Lil Big Invasion: Try Before You Buy! | Approaching Blocks: 🖤 A sequel is out — GIRL.EXE.EXE
external_coverage,Launches & Release Timing,demo,166,0.0194,0.0756,0.0562,"Consume Me: Consume Me, a life-sim RPG that'll remind you that you hated being a teenager, actually, has a demo out now | Moonsigil Atlas: The fusion of deck-building and space-Tetris in the demo of Moonsigil Atlas has totally hooked me | Starlight Revolver: Anime action RPG studio Pahdo Labs shuts down despite accruing $17.5M in funding: 'We believed making a demo of a familiar but new game would be our best shot'"
external_coverage,Launches & Release Timing,playtest,73,0.0077,0.0588,0.0512,"Horizon Hunters Gathering: Boy, this is awkward: Sony drops the first Horizon Hunters Gathering playtest directly on top of the Marathon server slam this weekend | Outward 2: Attention survival game sickos: you can be among the first to playtest the sequel to one of my favorite survival RPGs | Animula Nook: Animula Nook Alpha Playtest Preview—Bigger On The Inside"
external_coverage,Launches & Release Timing,access release,26,0.0032,0.0336,0.0304,"Deep Rock Galactic: Rogue Core: Deep Rock Galactic: Survivor is adding a bulldozing new class, while fellow spinoff Rogue Core gets an early access release date | Subnautica 2: A day after Unknown Worlds' ousted CEO gets reinstated, Subnautica 2 gets an early access release date | Subnautica 2: Subnautica 2 set for early access release in May as Krafton signals surrender: 'We look forward to working with Ted Gill to support a smooth transition and work toward a successful launch'"
external_coverage,Launches & Release Timing,early access release,26,0.0032,0.0336,0.0304,"Deep Rock Galactic: Rogue Core: Deep Rock Galactic: Survivor is adding a bulldozing new class, while fellow spinoff Rogue Core gets an early access release date | Subnautica 2: A day after Unknown Worlds' ousted CEO gets reinstated, Subnautica 2 gets an early access release date | Subnautica 2: Subnautica 2 set for early access release in May as Krafton signals surrender: 'We look forward to working with Ted Gill to support a smooth transition and work toward a successful launch'"
external_coverage,Launches & Release Timing,demo out,46,0.0052,0.0336,0.0284,"Consume Me: Consume Me, a life-sim RPG that'll remind you that you hated being a teenager, actually, has a demo out now | Moonsigil Atlas: The fusion of deck-building and space-Tetris in the demo of Moonsigil Atlas has totally hooked me | The Touhou Empires: New RTS game is anime Age of Empires, with a free Steam demo out now"
external_coverage,Launches & Release Timing,access release date,15,0.0019,0.0252,0.0233,"Deep Rock Galactic: Rogue Core: Deep Rock Galactic: Survivor is adding a bulldozing new class, while fellow spinoff Rogue Core gets an early access release date | Subnautica 2: A day after Unknown Worlds' ousted CEO gets reinstated, Subnautica 2 gets an early access release date | Subnautica 2: Subnautica 2's early access release date was ""self-servingly"" leaked by Krafton, ""further damaging the game"", claim lawyers for reinstated Unknown Worlds CEO"
external_coverage,Launches & Release Timing,years after launch,41,0.0065,0.0252,0.0187,"Retro City Rampage™ DX: 12 years after launch, this GTA style crime game just got a surprise update | Roadwarden: Roadwarden, one of the best RPGs ever made, launches final update | WWE 2K24: 2K Games chokes out another WWE game just 2 years after launch"
external_coverage,Launches & Release Timing,confirmed release,17,0.0024,0.0168,0.0144,Toukiden: Kiwami: Hunt those monsters with Toukiden 2 on PC in March | Capes: Superhero strategy game Capes confirmed for release on May 29th | Kathy Rain 2: Soothsayer: Point-and-click urban thriller Kathy Rain 2: Soothsayer launches May 20
external_coverage,Launches & Release Timing,launch,2456,0.3740,0.1765,-0.1975,"Nioh: Complete Edition: Wo Long is already Team Ninja's biggest ever Steam launch, despite PC port issues | Quake II Mission Pack: The Reckoning: Carmack remembers Quake on 15th anniversary | Lords Of The Fallen™ 2014: Somehow, Lords of the Fallen continues to get major patches - and its biggest one yet just gave everyone an unbeatable reason to play"
external_coverage,Launches & Release Timing,update,788,0.1257,0.0420,-0.0837,"Nuclear Throne: Classic roguelike top-down shooter Nuclear Throne major update 100 out now | Scribblenauts Unlimited: Looks like Scribblenauts is getting a revival on PS4, Xbox, Switch | Retro City Rampage™ DX: 12 years after launch, this GTA style crime game just got a surprise update"
external_coverage,Launches & Release Timing,dlc,410,0.0680,0.0084,-0.0596,"Impire: Imp-rove Impire With Some Free DLC | Real Farm: Real Farm to add two DLC packs this week | Indiana Jones and the Great Circle: It's shaping up to be a crazy month for new games, with Indiana Jones' beefy-looking story DLC finally arriving on September 4"
external_coverage,Launches & Release Timing,expansion,314,0.0534,0.0084,-0.0450,"RuneScape ®: Solve a crab housing crisis and fight a Dreadhog in part one of Runescape's big Havenhythe expansion, which is out now | Fallout: New Vegas: Fallout Chicago, a DLC-sized New Vegas mod about the Brotherhood of Steel fighting a union mob, has a first demo out now | Megaquarium: Aquarium building sim Megaquarium gets a big free update and new DLC"
external_coverage,Launches & Release Timing,patch,212,0.0342,0.0000,-0.0342,"Marvel's Spider-Man 2: Marvel's Spider-Man 2 gets NVIDIA DLSS 4 improvements and a Steam Deck / SteamOS fix | STAR WARS: Battlefront Classic Collection: After a historically bad launch, Star Wars: Battlefront Classic Collection's first patch has fans cautiously optimistic: 'Faith is being restored' | Nightingale: Nightingale gets font improvements for Steam Deck"
external_coverage,Launches & Release Timing,coming,436,0.0665,0.0336,-0.0329,"Alan Wake's American Nightmare: One of the year's best games headlines October Game Pass titles | Five Nights at Freddy's: FNAF Secret of the Mimic release date, news, and details | Toukiden: Kiwami: Hunt those monsters with Toukiden 2 on PC in March"
external_coverage,Launches & Release Timing,launch trailer,175,0.0305,0.0000,-0.0305,"Midair: Free-to-play jetpack FPS Midair rides launch trailer out of Early Access | Shiness: The Lightning Kingdom: FRPG Shiness: The Lightning Kingdom launches | Graveyard Keeper: Graveyard Keeper launch trailer showcases crafting, quests, and corpse disposal"
external_coverage,Launches & Release Timing,release out,164,0.0286,0.0000,-0.0286,Delete: Wot I Think: Delete | Space Hulk: Deathwing: Wot I Think Space Hulk: Tactics | Thrive: Evolution sim Thrive v0.6.3 gives a glimpse of the future
external_coverage,Major Content Updates,update out,36,0.0181,0.1429,0.1247,"Nuclear Throne: Classic roguelike top-down shooter Nuclear Throne major update 100 out now | Retro City Rampage™ DX: 12 years after launch, this GTA style crime game just got a surprise update | Brotato: Brotato gets a juicy free update out now - along with new Linux and macOS support"
external_coverage,Major Content Updates,major update,228,0.1270,0.2143,0.0873,The Elder Scrolls V: Skyrim Special Edition: Popular Skyrim mod returns after 9 years with a major update and a full source code release to keep it relevant 'for many years to come' | Moonsigil Atlas: You absolutely have to try the expanded demo of Moonsigil Atlas | Nuclear Throne: Classic roguelike top-down shooter Nuclear Throne major update 100 out now
external_coverage,Major Content Updates,after launch,12,0.0077,0.0714,0.0638,"Retro City Rampage™ DX: 12 years after launch, this GTA style crime game just got a surprise update | V Rising: Stellar vampire survival game continues Steam climb after 1.0 launch | Last Epoch: Last Epoch dev plans ""substantial new content for free"" after launch"
external_coverage,Major Content Updates,update released updates,43,0.0286,0.0714,0.0428,America's Army 3: America's Army 3 Update Released | Victoria II: Victoria II Update Released | A.R.E.S.: Extinction Agenda: A.R.E.S. Update Released
external_coverage,Major Content Updates,chapter,51,0.0307,0.0714,0.0407,ULTRAKILL: Brutal boomer shooter Ultrakill makes its new chapter even better with over 120 precision changes | Void Sols: This 2D minimalist soulslike perfectly understands why the genre works | Yakuza Kiwami: Yakuza: Like A Dragon is coming to PC this year
external_coverage,Major Content Updates,launch,67,0.0363,0.0714,0.0351,"Retro City Rampage™ DX: 12 years after launch, this GTA style crime game just got a surprise update | Wildgate: Wildgate Receives New Game Modes, Character and More In Massive Content Update | Janosik 2: Action-platformer metroidvania Janosik 2 will be a 'bigger, bolder adventure' launching December 9"
external_coverage,Major Content Updates,update released,82,0.0551,0.0714,0.0163,America's Army 3: America's Army 3 Update Released | Ex-Zodiac: Starfox-esque 3D Shooter Ex-Zodiac gets a major update with a new level | Victoria II: Victoria II Update Released
external_coverage,Major Content Updates,release,94,0.0558,0.0714,0.0156,"The Elder Scrolls V: Skyrim Special Edition: Popular Skyrim mod returns after 9 years with a major update and a full source code release to keep it relevant 'for many years to come' | DEATH STRANDING 2: ON THE BEACH: Death Stranding 2's PC launch comes with a tougher new mode and, staying true to the brand, live-action cutscenes | Football Manager 2017: Everything we know about Football Manager 2017 - beta, features, release date, system requirements"
external_coverage,Major Content Updates,content,652,0.4096,0.1429,-0.2668,NEODUEL: Backpack Monsters: Inventory management battler NeoDuel: Backpack Monsters gets new content - we have keys to give away | Call of Duty: Advanced Warfare - Gold Edition: New DLC Available - Call of Duty : Advanced Warfare - Reckoning | Defenders of Ardania: New DLC Available - Defenders of Ardania: Battlemagic
external_coverage,Major Content Updates,dlc,382,0.2526,0.0714,-0.1812,Call of Duty: Advanced Warfare - Gold Edition: New DLC Available - Call of Duty : Advanced Warfare - Reckoning | Defenders of Ardania: New DLC Available - Defenders of Ardania: Battlemagic | Defenders of Ardania: New DLC Available - Defenders of Ardania: The Conjurer's Tricks
external_coverage,Major Content Updates,content available,305,0.2059,0.0714,-0.1344,Call of Duty: Advanced Warfare - Gold Edition: New DLC Available - Call of Duty : Advanced Warfare - Reckoning | Assassin’s Creed III: New DLC Available - Assassin’s Creed® III – The Hidden Secrets Pack | Assassin’s Creed III: New DLC Available - Assassin’s Creed® III: The Betrayal
external_coverage,Major Content Updates,dlc available,304,0.2031,0.0714,-0.1316,Call of Duty: Advanced Warfare - Gold Edition: New DLC Available - Call of Duty : Advanced Warfare - Reckoning | Defenders of Ardania: New DLC Available - Defenders of Ardania: Battlemagic | Defenders of Ardania: New DLC Available - Defenders of Ardania: The Conjurer's Tricks
external_coverage,Major Content Updates,expansion,114,0.0712,0.0000,-0.0712,"Airships: Lost Flotilla: Steampunk auto-shooter Airships: Lost Flotilla gets a big free content update | Disney Dreamlight Valley: Disney Dreamlight Valley unveils game-changing new feature, huge expansion pass | Magic 2015 - Duels of the Planeswalkers: New DLC Available - Magic 2015 - Garruk's Revenge Expansion"
external_coverage,Major Content Updates,content update,102,0.0565,0.0000,-0.0565,"Wildgate: Wildgate Receives New Game Modes, Character and More In Massive Content Update | Airships: Lost Flotilla: Steampunk auto-shooter Airships: Lost Flotilla gets a big free content update | Thronefall: Thronefall is pure strategy game, and its final content update is a big one"
external_coverage,Major Content Updates,patch,86,0.0565,0.0000,-0.0565,"Crimson Desert: Crimson Desert patch stops bosses attacking you mid-revival, also takes aim at crashes and UI problems | Age of Empires IV: Anniversary Edition: Age of Empires 4 is having a ranked seasons test this week | Deadlock: Deadlock's latest patch buffs three of the most annoying heroes but manages to leave out the biggest thorn in my side"
external_coverage,Major Content Updates,pack content,72,0.0488,0.0000,-0.0488,Assassin’s Creed III: New DLC Available - Assassin’s Creed® III – The Hidden Secrets Pack | Call of Duty®: Modern Warfare® 3 (2011): New DLC Available - Call of Duty®: Modern Warfare® 3 Collection 3: Chaos Pack | Realm of the Mad God Exalt: New DLC Available - Realm of the Mad God: Steam Booster Pack
external_coverage,Patch / Hotfix / Bug Fixes,update version,25,0.0023,0.0294,0.0271,"Lugaru HD: Overgrowth s final update feels like the end of an era |  Fieldrunners 2: Fieldrunners 2 Product Update | Satisfactory: Huzzah! Satisfactory version 1.2, now in beta, lets you actually pause your game, and you can take selfies now too"
external_coverage,Patch / Hotfix / Bug Fixes,recent update,29,0.0030,0.0294,0.0264,"Freedom Force vs. the Third Reich: Final Fantasy XV Survey Seeks Fan Feedback on Next DLC | Left 4 Dead 2: Left 4 Dead 2 gets a compatibility update for Linux | Kingdom Come: Deliverance: Three years after its last update, the original Kingdom Come: Deliverance gets a new patch that includes a new caparison for your horse"
external_coverage,Patch / Hotfix / Bug Fixes,first update,46,0.0044,0.0294,0.0251,"Hollow Knight: Just in time for Hollow Knight's 9th birthday, Team Cherry rolled out its first update in years, including better support for ultrawide monitors and the Steam Deck screen | The Swapper: One of the best puzzle games on Steam just got its first update in 11 years and is also verified for Steam Deck: 'We couldn't resist including some visual, aural, and input adjustments' | Reforj: Spiritual Minecraft successor Reforj transforms building tools in first update"
external_coverage,Patch / Hotfix / Bug Fixes,dlc,338,0.0361,0.0588,0.0228,Dungeons of Hinterberg: Charming RPG Dungeons of Hinterberg ramps up the style in new update | Freedom Force vs. the Third Reich: Final Fantasy XV Survey Seeks Fan Feedback on Next DLC | X3: Terran Conflict: X3: Farnham's Legacy now available for Linux with Linux fixes for other games live
external_coverage,Patch / Hotfix / Bug Fixes,update read,27,0.0022,0.0196,0.0174,No Man's Sky: No Man's Sky Remnant update brings a fancy gravity gun and customizable trucks | Left 4 Dead 2: Left 4 Dead 2 gets a compatibility update for Linux | Tchia: This year's most delightful open world adventure is coming to Steam in March
external_coverage,Patch / Hotfix / Bug Fixes,after launch,28,0.0029,0.0196,0.0167,"Retro City Rampage™ DX: 12 years after launch, this GTA style crime game just got a surprise update | Roadwarden: Roadwarden, one of the best RPGs ever made, launches final update | Eldegarde: A team of volunteers is fighting to preserve ""mini-MMO"" Eldegarde after its sudden removal from Steam"
external_coverage,Patch / Hotfix / Bug Fixes,update out,225,0.0228,0.0392,0.0165,"DOOM Eternal: The Ancient Gods - Part One: Doom Eternal's free next-gen update out late June | Nuclear Throne: Classic roguelike top-down shooter Nuclear Throne major update 100 out now | Retro City Rampage™ DX: 12 years after launch, this GTA style crime game just got a surprise update"
