scope,theme,phrase,doc_count,early_share,late_share,trend_delta,sample_titles
external_coverage,Servers / Maintenance / Downtime / Apologies,been released update,171,0.0948,0.0000,-0.0948,Source Filmmaker: Source Filmmaker 0.9.5.17 Released | Ys Origin: Ys Origin Update Released | Portal 2: Portal 2 Update Released
external_coverage,Servers / Maintenance / Downtime / Apologies,released update applied,171,0.0948,0.0000,-0.0948,Source Filmmaker: Source Filmmaker 0.9.5.17 Released | Ys Origin: Ys Origin Update Released | Portal 2: Portal 2 Update Released
external_coverage,Roadmaps / Devlogs / Feature Previews,preview,308,0.4685,0.7273,0.2588,Football Manager Touch 2018: Football Manager 2019 preview: a meaningful step forward for the series | Animula Nook: Animula Nook Alpha Playtest Preview—Bigger On The Inside | Solasta II: Solasta II Early Access Preview—Deep Strategic Roleplaying
external_coverage,Roadmaps / Devlogs / Feature Previews,demo,12,0.0177,0.1818,0.1641,"Luna Abyss: Luna Abyss Extended Demo (PC) Preview — Going Further Into The Abyss | Circle of Sumo: Online Rumble!: The 10 most exciting indie games from Rezzed Digital 2020 | Deep Rock Galactic: Survivor: Deep Rock Galactic's first spin-off is out now in Early Access, and it's the best auto-shooter since Vampire Survivors"
external_coverage,Roadmaps / Devlogs / Feature Previews,developer update,11,0.0157,0.0909,0.0752,"DOOM: The Dark Ages: Diablo 4's next season is short, but it lets you become The Butcher, and it has Doom: The Dark Ages skins you probably can't afford | Diablo IV: Diablo 4’s Warlock looks like an unhinged Necromancer with Sorcerer energy in first look at gameplay | The Last Starship: The Last Starship's devs show mining vessels and player feedback"
external_coverage,Roadmaps / Devlogs / Feature Previews,season,16,0.0256,0.0909,0.0653,"DOOM: The Dark Ages: Diablo 4's next season is short, but it lets you become The Butcher, and it has Doom: The Dark Ages skins you probably can't afford | Marvel Rivals: The season of game company gaffes continues with NetEase apologizing for a Marvel Rivals preview contract that asked streamers not to make 'subjective negative reviews of the game' | Marvel Rivals: Marvel Rivals' most exciting change in Season 3 is removing the need to grind the game every single day"
external_coverage,Roadmaps / Devlogs / Feature Previews,event,16,0.0295,0.0909,0.0614,WWE 2K26: WWE 2K26 Feels Bigger and Bolder at Creator Fest Preview Event | Lies of P: Lies of P is getting difficulty options and an ultra-hard boss rush mode | Monster Hunter Wilds: New Monster Hunter Wilds Blossom event is overflowing with free rewards
external_coverage,Roadmaps / Devlogs / Feature Previews,dlc,31,0.0531,0.0909,0.0378,"Ravenswatch: New Ravenswatch roadmap makes plans into 2027 despite publisher's financial struggles | Disney Dreamlight Valley: Disney Dreamlight Valley just announced its second DLC featuring 4 new characters, along with a free update coming in December | Borderlands® 4: New Borderlands 4 roadmap details story DLC, free updates, and yes, Pearlescents"
external_coverage,Roadmaps / Devlogs / Feature Previews,festival,14,0.0177,0.0000,-0.0177,Godstrike: Steam Game Festival 2021: Godstrike hands-on preview | Dino Galaxy Tennis: Steam Game Festival 2021: Dino Galaxy Tennis hands-on preview | Winter Ember: Steam Game Festival 2021: Winter Ember hands-on preview
external_coverage,Roadmaps / Devlogs / Feature Previews,soon,10,0.0177,0.0000,-0.0177,"Norland: Norland dev scraps daily patches but a content roadmap is coming soon | Dwarf Fortress: Dwarf Fortress gets some more fixes, a preview of the Siege Update due soon and a modding jam | Jet Lancer: Jet Lancer locks on for a summer launch"
external_coverage,Roadmaps / Devlogs / Feature Previews,roadmap,173,0.2756,0.0909,-0.1847,"Ravenswatch: New Ravenswatch roadmap makes plans into 2027 despite publisher's financial struggles | Rocket Arena: Rocket Arena - Details zur ersten Saison und Roadmap zum Live-Service | Age of Empires IV: Anniversary Edition: Age of Empires 4 roadmap outlines next patch, mod tools, and ranked seasons"
external_coverage,Roadmaps / Devlogs / Feature Previews,coming,49,0.0827,0.0000,-0.0827,"Disney Dreamlight Valley: Disney Dreamlight Valley just announced its second DLC featuring 4 new characters, along with a free update coming in December | Disney Dreamlight Valley: Disney Dreamlight Valley has shared its new roadmap for the rest of 2025, and it looks like one character fans have been asking for since launch is finally coming to stay | Disney Dreamlight Valley: The first look at Disney Dreamlight Valley's 2026 roadmap hints at Lady and the Tramp, Pocahontas, and Hercules coming to the game"
external_coverage,Roadmaps / Devlogs / Feature Previews,hands-on preview,45,0.0669,0.0000,-0.0669,Shadow Labyrinth: Shadow Labyrinth Hands-On Preview: Devouring Everything | Towa and the Guardians of the Sacred Tree: Towa and the Guardians of the Sacred Tree Hands-On Preview – A Vibrant Spin On The Roguelike Formula | Godstrike: Steam Game Festival 2021: Godstrike hands-on preview
external_coverage,Roadmaps / Devlogs / Feature Previews,release,34,0.0571,0.0000,-0.0571,"Forspoken: Forspoken gameplay showcase offers final preview before release | Sid Meier's Civilization VII: Civilization VII gets a mixed reception on Steam, Firaxis say they're listening and put up a small roadmap | Norland: Norland dev scraps daily patches but a content roadmap is coming soon"
external_coverage,Roadmaps / Devlogs / Feature Previews,update,83,0.1398,0.0909,-0.0489,"DOOM: The Dark Ages: Diablo 4's next season is short, but it lets you become The Butcher, and it has Doom: The Dark Ages skins you probably can't afford | The Elder Scrolls IV: Oblivion Game of the Year Edition Deluxe (2009): Skyblivion's first major dev update since Oblivion Remastered makes its case as more of a full remake⁠—including a mega dungeon based off a legendary bit of cut content | Diablo IV: Diablo 4’s Warlock looks like an unhinged Necromancer with Sorcerer energy in first look at gameplay"
external_coverage,Roadmaps / Devlogs / Feature Previews,content,29,0.0413,0.0000,-0.0413,"The Elder Scrolls IV: Oblivion Game of the Year Edition Deluxe (2009): Skyblivion's first major dev update since Oblivion Remastered makes its case as more of a full remake⁠—including a mega dungeon based off a legendary bit of cut content | Disney Dreamlight Valley: Disney Dreamlight Valley roadmap reveals a whole new world and more | Disney Dreamlight Valley: Disney Dreamlight Valley just announced its second DLC featuring 4 new characters, along with a free update coming in December"
external_coverage,Roadmaps / Devlogs / Feature Previews,launch,28,0.0374,0.0000,-0.0374,"Rocket Arena: Rocket Arena - Details zur ersten Saison und Roadmap zum Live-Service | Dune: Spice Wars: Dune: Spice Wars roadmap teases multiplayer, a mystery faction and whole bunch more | Disney Dreamlight Valley: Disney Dreamlight Valley has shared its new roadmap for the rest of 2025, and it looks like one character fans have been asking for since launch is finally coming to stay"
external_coverage,Roadmaps / Devlogs / Feature Previews,expansion,19,0.0335,0.0000,-0.0335,"Disney Dreamlight Valley: Disney Dreamlight Valley patch notes - The Remembering update is here | HITMAN 2: Hitman 2's June roadmap includes the bank level, and more | The Sims™ 4: Summer finally gets going in The Sims 4 with a roadmap, and the reveal of a new expansion next week"
external_coverage,Balance / Characters / Items / Meta Changes,release,109,0.0343,0.0870,0.0527,"Death and the Fly: New Release: Death and the Fly | Deep Rock Galactic: Rogue Core: Deep Rock Galactic: Survivor is adding a bulldozing new class, while fellow spinoff Rogue Core gets an early access release date | Marathon: ""So that we don't flood the game with amazing loot"": Marathon director defends Cryo Archive's weekend-only release in the name of balance, queue times and player prep"
external_coverage,Balance / Characters / Items / Meta Changes,balance,160,0.0573,0.1087,0.0514,"State of Decay 2: Juggernaut Edition: State of Decay 2 at a huge 90% discount while you can | Lost Ark: As key Lost Ark devs leave, Amazon Games says ""trust is earned through actions, not words"" | ARMORED CORE™ VI FIRES OF RUBICON™: Armored Core 6 gets first patch in six months, includes huge balance changes"
external_coverage,Balance / Characters / Items / Meta Changes,episode,14,0.0050,0.0435,0.0385,Double Dragon IV: Double Dragon 4 brings throwback beatdowns | Hinterland: COGWATCH 4. The Long Dark | Destiny 2: Destiny 2's next act will bring Street Fighter 6 cosmetics and a 300% buff to roaming supers
external_coverage,Balance / Characters / Items / Meta Changes,best character,12,0.0042,0.0217,0.0176,"SPORE™ Creepy & Cute Parts Pack: Five of the Best: Character Creators | FATAL FURY: City of the Wolves: A second Fatal Fury: City of the Wolves beta is coming March 26, this time featuring the undisputed best character | Mortal Kombat 11: Mortal Kombat 11 tier list: All fighters ranked plus best characters by playstyle"
external_coverage,Balance / Characters / Items / Meta Changes,each character,14,0.0046,0.0217,0.0171,"Death and the Fly: New Release: Death and the Fly | Dragon Age: Origins: Every origin in Dragon Age: Origins, ranked | Apex Legends™: Apex Legends classes explained - each new character class in-depth"
external_coverage,Balance / Characters / Items / Meta Changes,release date,29,0.0075,0.0217,0.0142,"Deep Rock Galactic: Rogue Core: Deep Rock Galactic: Survivor is adding a bulldozing new class, while fellow spinoff Rogue Core gets an early access release date | Chasing the Unseen: Shadow of the Colossus meets Journey in titan-climbing new indie game | SAND LAND: Sand Land release date, trailers, and latest news"
external_coverage,Balance / Characters / Items / Meta Changes,event,30,0.0105,0.0217,0.0113,"Marathon: ""So that we don't flood the game with amazing loot"": Marathon director defends Cryo Archive's weekend-only release in the name of balance, queue times and player prep | Chasing the Unseen: Shadow of the Colossus meets Journey in titan-climbing new indie game | Call of Duty®: Modern Warfare® 3 (2011): Call of Duty: Modern Warfare 3 trailer shows bouncing betty bombs, air strikes, kit loadouts"
external_coverage,Balance / Characters / Items / Meta Changes,date,41,0.0121,0.0217,0.0096,"Deep Rock Galactic: Rogue Core: Deep Rock Galactic: Survivor is adding a bulldozing new class, while fellow spinoff Rogue Core gets an early access release date | Chasing the Unseen: Shadow of the Colossus meets Journey in titan-climbing new indie game | SAND LAND: Sand Land release date, trailers, and latest news"
external_coverage,Balance / Characters / Items / Meta Changes,update,427,0.1510,0.0652,-0.0858,RollScape: Overlooked dice-based roguelike Rollscape expands with meta-progression update | Battleborn: Battleborn: No more content after Fall Update | America's Army 3: America's Army 3 Update Released
external_coverage,Balance / Characters / Items / Meta Changes,dlc,158,0.0590,0.0000,-0.0590,"SAMURAI SHODOWN V SPECIAL / サムライスピリッツ零スペシャル: Samurai Shodown hits Steam 14th June with a new DLC character | Dragon Age: Origins: New Dragon Age: Origins DLC Named, Dated, Priced - Darkspawn Chronicles | Disney Dreamlight Valley: How to unlock Snow White in Disney Dreamlight Valley"
external_coverage,Balance / Characters / Items / Meta Changes,weapon,319,0.1159,0.0652,-0.0506,"HandFoot: Inspired by 80s and 90s trash-horror cinema, 3rd person action game HandFoot looks hilarious | Throne and Liberty: Throne and Liberty's new Orb weapon is pushing its rivals out of the MMORPG | RailGods of Hysterra: Lovecraftian survival game RailGods of Hysterra shows off its weapon arsenal"
external_coverage,Balance / Characters / Items / Meta Changes,character,865,0.3112,0.2609,-0.0503,"Double Dragon IV: Double Dragon 4 brings throwback beatdowns | LEGO® MARVEL's Avengers: Five of the Best: Achievements or Trophies | Rivals of Aether: The best Smash Bros.-like on Steam just added a character who can shop for items and go fishing in the middle of a match, in case you thought fighting games were too one-note"
external_coverage,Balance / Characters / Items / Meta Changes,patch,164,0.0556,0.0217,-0.0339,"ARMORED CORE™ VI FIRES OF RUBICON™: Armored Core 6 gets first patch in six months, includes huge balance changes | Age of Empires IV: Anniversary Edition: Age of Empires 4 is having a ranked seasons test this week | WWE 2K20: WWE 2K20 promise a patch for all those wrestling mishaps"
external_coverage,Balance / Characters / Items / Meta Changes,season,95,0.0230,0.0000,-0.0230,Deadlock: New Deadlock tool uncovers meta builds based on real player stats | Disney Dreamlight Valley: How to unlock Scar in Disney Dreamlight Valley | FATAL FURY: City of the Wolves: Fatal Fury fans accuse new City of the Wolves trailer of being filled with AI slop: 'All that Saudi money and can't pay someone a couple bucks to make real s**t'
external_coverage,Balance / Characters / Items / Meta Changes,launch,74,0.0226,0.0000,-0.0226,"Wildgate: Wildgate Receives New Game Modes, Character and More In Massive Content Update | SWORD ART ONLINE Fractured Daydream: Sword Art Online Fractured Daydream follows launch success with a new character | DwarfHeim: Co-op RTS DwarfHeim tunnels out of Early Access this month"
external_coverage,Balance / Characters / Items / Meta Changes,expansion,45,0.0180,0.0000,-0.0180,"Deep Rock Galactic: Survivor: Deep Rock Galactic: Survivor is getting an expansion that introduces the series' first ever new class, and it’s a dwarf driving a weaponised bulldozer that flattens terrain and enemies alike | Deadlock: New Deadlock hero Apollo completes Valve's massive roster expansion, and the MOBA's vision feels clearer than ever | Cyberpunk 2077: Cyberpunk 2077: Phantom Liberty Iconic weapon locations"
external_coverage,Platform / Account / Crossplay / Technical Changes,demo,54,0.0129,0.0702,0.0572,The Darkside Detective: Backside of the Moon: The Darkside Detective: Backside of the Moon gets a first demo | Wild Horse Racing: Timing is everything in the fast-paced arcade racer Wild Horse Racing - try the demo now | Aperture Desk Job: Aperture Desk Job from Valve is out now and it's ridiculous
external_coverage,Platform / Account / Crossplay / Technical Changes,release,306,0.1083,0.1404,0.0320,"Hector: Episode 1: New Release - Hector: Badge of Carnage - Episode Two, 25% off Full Series! | Death and the Fly: New Release: Death and the Fly | Elizabeth Find M.D. - Diagnosis Mystery - Season 2: New Release - Elizabeth Find M.D. - Diagnosis Mystery - Season 2"
external_coverage,Platform / Account / Crossplay / Technical Changes,character,14,0.0045,0.0351,0.0306,"Rivals of Aether: The best Smash Bros.-like on Steam just added a character who can shop for items and go fishing in the middle of a match, in case you thought fighting games were too one-note | Death and the Fly: New Release: Death and the Fly | Rise of the Triad: Ludicrous Edition: Rise of the Triad: Ludicrous Edition update adds cross-platform multiplayer, another cut character, and more"
external_coverage,Platform / Account / Crossplay / Technical Changes,season,24,0.0071,0.0351,0.0280,"Elizabeth Find M.D. - Diagnosis Mystery - Season 2: New Release - Elizabeth Find M.D. - Diagnosis Mystery - Season 2 | Far Cry®: Far Cry's getting a TV series starring It's Always Sunny's Rob Mac, with each season designed to mirror a new game | Football Manager 2017: Everything we know about Football Manager 2017 - beta, features, release date, system requirements"
external_coverage,Platform / Account / Crossplay / Technical Changes,demo available,12,0.0027,0.0175,0.0149,The Darkside Detective: Backside of the Moon: The Darkside Detective: Backside of the Moon gets a first demo | FOUNTAINS: FOUNTAINS is a promising looking metroidvania action-RPG with a demo up | Quartet: Try out the new demo of the upcoming JRPG inspired Quartet
external_coverage,Platform / Account / Crossplay / Technical Changes,small update,10,0.0027,0.0175,0.0149,"Shadows of Adam: Inspired by classic JRPGs, Shadows of Adam gets improved Linux and Steam Deck support | LEGO The Incredibles: LEGO The Incredibles gets a small update to improve Steam Deck support | Assassin's Creed Mirage: Assassin's Creed Mirage gets improved Steam Deck support and now rated Playable"
external_coverage,Platform / Account / Crossplay / Technical Changes,fresh update,12,0.0040,0.0175,0.0135,Left 4 Dead 2: Left 4 Dead 2 gets a compatibility update for Linux | Marvel's Spider-Man 2: Marvel's Spider-Man 2 now Steam Deck Verified with a fresh update out to improve performance | The Last of Us Part I: The Last of Us Part I gets AMD FSR 4 and an audio fix for Steam Deck
external_coverage,Platform / Account / Crossplay / Technical Changes,episode,15,0.0053,0.0175,0.0122,"Hector: Episode 1: New Release - Hector: Badge of Carnage - Episode Two, 25% off Full Series! | Scarlet Hollow: Scarlet Hollow Episode 2 due out in early June, play the first episode free | Counter-Strike: Condition Zero: Counter-Strike: Condition Zero assaults Linux"
external_coverage,Platform / Account / Crossplay / Technical Changes,update released,89,0.0383,0.0000,-0.0383,Ex-Zodiac: Starfox-esque 3D Shooter Ex-Zodiac gets a major update with a new level | Sword of the Stars II: Enhanced Edition: Sword of the Stars II: Lords of Winter Update Released | Tiny Garden: Create a pocket-sized garden inside a magical toy in Tiny Garden out now with Linux support
external_coverage,Platform / Account / Crossplay / Technical Changes,launch,121,0.0432,0.0175,-0.0257,"Call of Duty: Ghosts: Call of Duty: Ghosts system requirements revealed | RPG Maker VX: Midweek Madness - RPG Maker series, 75% Off | Meteorfall: Rustbowl Rumble: A deck-builder for busy people, Bramble Royale: A Meteorfall Story plans full Steam Deck support for launch"
external_coverage,Platform / Account / Crossplay / Technical Changes,update,436,0.1627,0.1404,-0.0224,"Shadows of Adam: Inspired by classic JRPGs, Shadows of Adam gets improved Linux and Steam Deck support | Hollow Knight: Just in time for Hollow Knight's 9th birthday, Team Cherry rolled out its first update in years, including better support for ultrawide monitors and the Steam Deck screen | The Swapper: One of the best puzzle games on Steam just got its first update in 11 years and is also verified for Steam Deck: 'We couldn't resist including some visual, aural, and input adjustments'"
external_coverage,Platform / Account / Crossplay / Technical Changes,date,53,0.0210,0.0000,-0.0210,"Football Manager 2017: Everything we know about Football Manager 2017 - beta, features, release date, system requirements | Trek to Yomi: Trek to Yomi release date is just weeks away | STAR WARS™: Squadrons: Star Wars Squadrons release date, multiplayer, cross-play, and more"
external_coverage,Platform / Account / Crossplay / Technical Changes,release out,48,0.0201,0.0000,-0.0201,Delete: Wot I Think: Delete | CrossCode: Wot I Think: CrossCode | Football Manager 2019: Wot I Think: Football Manager 2019
external_coverage,Platform / Account / Crossplay / Technical Changes,release out windows,41,0.0169,0.0000,-0.0169,Delete: Wot I Think: Delete | CrossCode: Wot I Think: CrossCode | Football Manager 2019: Wot I Think: Football Manager 2019
external_coverage,Platform / Account / Crossplay / Technical Changes,release date,43,0.0165,0.0000,-0.0165,"Football Manager 2017: Everything we know about Football Manager 2017 - beta, features, release date, system requirements | Trek to Yomi: Trek to Yomi release date is just weeks away | STAR WARS™: Squadrons: Star Wars Squadrons release date, multiplayer, cross-play, and more"
external_coverage,Platform / Account / Crossplay / Technical Changes,fix,43,0.0156,0.0000,-0.0156,"Marvel's Spider-Man 2: Marvel's Spider-Man 2 gets NVIDIA DLSS 4 improvements and a Steam Deck / SteamOS fix | Airborne Empire: Airborne Empire an open-world city-building RPG gets a Linux / Steam Deck freezing fix | Borderlands® 4: Borderlands 4 gets a new PC patch to fix crashes, progression blockers and GPU-related problems"
external_coverage,Monetization / Store / Pass / Currency,sale,11,0.0190,0.2000,0.1810,"Delicious - Emily's New Beginning: Gamehouse Publisher Sale - Up To 50% Off! | PRO EVOLUTION SOCCER 2019: Konami stops PES 2019 in-game currency sales in Belgium | Hellbreach: Vegas: The spiritual successor to old school pick-up-and-play Call of Duty Zombies is out now, on sale for $10 and gloriously free of battle pass nonsense"
external_coverage,Monetization / Store / Pass / Currency,update,48,0.0952,0.1000,0.0048,Dead Horde: Dead Horde Update Released | Age of Empires IV: Anniversary Edition: Age of Empires 4 fans are upset over regional pricing differences | Dragon Age: Origins: Dragon Age 'Darkspawn' DLC Screens Mark Launch
external_coverage,Monetization / Store / Pass / Currency,event,10,0.0190,0.0000,-0.0190,"Marvel Rivals: Marvel Rivals is bringing back Chrono Rush, among other fixes, in its latest patch: 'With no cap on how many points you can earn' | Elite Dangerous: Elite Dangerous teases fleet carriers and rebrands its premium currency | Paratopic: The next game from Paratopic’s devs has a tropical Paradise Killer feel"
external_coverage,Monetization / Store / Pass / Currency,coming,19,0.0452,0.0000,-0.0452,"Enlisted: 100-player shooter Enlisted: Reinforced halts sales on Steam due to anger over pricing and a bug that 'completely breaks' account linking | RuneScape ®: Thanks to a massive community vote, Jagex are removing RuneScape's notorious Treasure Hunter microtransactions | Killing Floor 3: Killing Floor 3 developer explains microtransactions"
external_coverage,Monetization / Store / Pass / Currency,content,20,0.0476,0.0000,-0.0476,DARK SOULS III: Dark Souls 3 DLC due early following console leak | Call of Duty: Modern Warfare 2 (2009): Modern Warfare 2 'Resurgence' DLC in Screenshots | New World: Aeternum: New World kicks off inaugural season with sparkly new battle pass
external_coverage,Monetization / Store / Pass / Currency,launch,25,0.0548,0.0000,-0.0548,"Quantum Conundrum: Pre-Purchase Now: Quantum Conundrum, receive 3 exclusive TF2 items! | Dragon Age: Origins: Dragon Age 'Darkspawn' DLC Screens Mark Launch | DARK SOULS III: Dark Souls 3 DLC due early following console leak"
external_coverage,Monetization / Store / Pass / Currency,release,32,0.0571,0.0000,-0.0571,"Hellbreach: Vegas: The spiritual successor to old school pick-up-and-play Call of Duty Zombies is out now, on sale for $10 and gloriously free of battle pass nonsense | Cubic Currency: Become a dodgy-dealing dice trader in Cubic Currency | Street Fighter™ 6: The Street Fighter 6 battle pass is not what I expected"
external_coverage,Monetization / Store / Pass / Currency,dlc,43,0.0905,0.0000,-0.0905,Dragon Age: Origins: Dragon Age 'Darkspawn' DLC Screens Mark Launch | Dragon Age: Origins: Most Dragon Age and Mass Effect DLC is now free on PC through Origin | Street Fighter™ 6: Street Fighter 6 Rashid battle pass gears up for his arrival
external_coverage,Monetization / Store / Pass / Currency,season,113,0.2333,0.0000,-0.2333,"WWE 2K18: WWE 2K18 season pass includes the Hardy Boyz and the 'Pumphandle Death Valley Driver' | WWE 2K18: WWE 2K18 won't have paid microtransactions, says 2K | Quantum Conundrum: Pre-Purchase Now: Quantum Conundrum, receive 3 exclusive TF2 items!"
external_coverage,Monetization / Store / Pass / Currency,season pass,82,0.1786,0.0000,-0.1786,"WWE 2K18: WWE 2K18 season pass includes the Hardy Boyz and the 'Pumphandle Death Valley Driver' | WWE 2K18: WWE 2K18 won't have paid microtransactions, says 2K | Quantum Conundrum: Pre-Purchase Now: Quantum Conundrum, receive 3 exclusive TF2 items!"
external_coverage,Monetization / Store / Pass / Currency,dlc,43,0.0905,0.0000,-0.0905,Dragon Age: Origins: Dragon Age 'Darkspawn' DLC Screens Mark Launch | Dragon Age: Origins: Most Dragon Age and Mass Effect DLC is now free on PC through Origin | Street Fighter™ 6: Street Fighter 6 Rashid battle pass gears up for his arrival
external_coverage,Monetization / Store / Pass / Currency,release,32,0.0571,0.0000,-0.0571,"Hellbreach: Vegas: The spiritual successor to old school pick-up-and-play Call of Duty Zombies is out now, on sale for $10 and gloriously free of battle pass nonsense | Cubic Currency: Become a dodgy-dealing dice trader in Cubic Currency | Street Fighter™ 6: The Street Fighter 6 battle pass is not what I expected"
external_coverage,Monetization / Store / Pass / Currency,launch,25,0.0548,0.0000,-0.0548,"Quantum Conundrum: Pre-Purchase Now: Quantum Conundrum, receive 3 exclusive TF2 items! | Dragon Age: Origins: Dragon Age 'Darkspawn' DLC Screens Mark Launch | DARK SOULS III: Dark Souls 3 DLC due early following console leak"
external_coverage,Monetization / Store / Pass / Currency,content,20,0.0476,0.0000,-0.0476,DARK SOULS III: Dark Souls 3 DLC due early following console leak | Call of Duty: Modern Warfare 2 (2009): Modern Warfare 2 'Resurgence' DLC in Screenshots | New World: Aeternum: New World kicks off inaugural season with sparkly new battle pass
external_coverage,Monetization / Store / Pass / Currency,coming,19,0.0452,0.0000,-0.0452,"Enlisted: 100-player shooter Enlisted: Reinforced halts sales on Steam due to anger over pricing and a bug that 'completely breaks' account linking | RuneScape ®: Thanks to a massive community vote, Jagex are removing RuneScape's notorious Treasure Hunter microtransactions | Killing Floor 3: Killing Floor 3 developer explains microtransactions"
